{
  "$schema": "https://json-schema.org/draft/2020-12/schema",
  "$id": "https://github.com/special-place-ai-heaven/aap-runner/blob/main/parity/contracts/cache-qualification.schema.json",
  "title": "zccache 1.15.6 per-platform qualification matrix (one document per platform)",
  "x-contract-version": 1,
  "x-owner": "P04 (writer); consumers P13, P14, P15, P16, P20 (cache state), P22, P24",
  "type": "object",
  "additionalProperties": false,
  "required": ["schema", "zccache", "platform", "matrix_revision", "rows"],
  "properties": {
    "schema": {"const": 1},
    "zccache": {
      "type": "object",
      "additionalProperties": false,
      "required": ["version", "commit", "archive", "archive_sha256", "binary_sha256"],
      "properties": {
        "version": {"const": "1.15.6"},
        "commit": {"const": "15ec9537af0d219e07b72ce2b3f97d5f68d72b5e"},
        "archive": {"enum": ["zccache-v1.15.6-x86_64-unknown-linux-musl.tar.gz", "zccache-v1.15.6-x86_64-pc-windows-msvc.zip"]},
        "archive_sha256": {"enum": ["885a109c758808480ebda6b92ac0c55ae55ff2638f0ef850423bb185f28e59f7", "a9e2b079946d00757a56fea3dacd8a47f9cb4bcbfe8c427ffd719ced59fd949b"]},
        "binary_sha256": {"type": ["string", "null"], "pattern": "^[0-9a-f]{64}$"}
      }
    },
    "platform": {"enum": ["linux-x86_64", "windows-x86_64"]},
    "matrix_revision": {"type": "integer", "minimum": 1},
    "rows": {
      "type": "array",
      "minItems": 1,
      "maxItems": 64,
      "items": {
        "type": "object",
        "additionalProperties": false,
        "required": ["compiler", "compiler_version", "invocation", "mode", "evidence_ref", "reason"],
        "properties": {
          "compiler": {"enum": ["rustc", "gcc", "g++", "clang", "clang++", "clang-cl", "cl", "link", "lld-link", "ld.lld", "nvcc", "emcc"]},
          "compiler_version": {"type": "string", "minLength": 1, "maxLength": 80, "pattern": "^[ -~]+$"},
          "invocation": {"enum": ["rustc-wrapper", "compile-object", "compile-pch", "response-file", "link", "preprocess-only", "depfile", "debug-pdb", "path-with-spaces", "unknown-flag"]},
          "mode": {"enum": ["qualified", "direct"]},
          "evidence_ref": {"type": ["string", "null"], "maxLength": 200, "pattern": "^parity/cache/qualification/"},
          "reason": {"type": "string", "maxLength": 200, "pattern": "^[ -~]*$"}
        }
      }
    }
  },
  "if": {"properties": {"platform": {"const": "linux-x86_64"}}},
  "then": {"properties": {"zccache": {"properties": {"archive": {"const": "zccache-v1.15.6-x86_64-unknown-linux-musl.tar.gz"}, "archive_sha256": {"const": "885a109c758808480ebda6b92ac0c55ae55ff2638f0ef850423bb185f28e59f7"}}}}},
  "else": {"properties": {"zccache": {"properties": {"archive": {"const": "zccache-v1.15.6-x86_64-pc-windows-msvc.zip"}, "archive_sha256": {"const": "a9e2b079946d00757a56fea3dacd8a47f9cb4bcbfe8c427ffd719ced59fd949b"}}}}}
}
