{
  "schema": 1,
  "zccache": {
    "version": "1.15.6",
    "commit": "15ec9537af0d219e07b72ce2b3f97d5f68d72b5e",
    "archive": "zccache-v1.15.6-x86_64-unknown-linux-musl.tar.gz",
    "archive_sha256": "885a109c758808480ebda6b92ac0c55ae55ff2638f0ef850423bb185f28e59f7",
    "binary_sha256": null
  },
  "platform": "linux-x86_64",
  "matrix_revision": 1,
  "rows": [
    {
      "compiler": "nvcc",
      "compiler_version": "12.6",
      "invocation": "compile-object",
      "mode": "direct",
      "evidence_ref": null,
      "reason": "CUDA unsupported at 1.15.6"
    }
  ]
}
